DE;EN;FR
nicht in einer seiner Amtssprachen;not drawn up in one of its official languages;n'est pas rédigé dans l'une de ses langues officielles
abgefasst ist;drawn up;rédigé dans
vorschreiben;prescribe;prescrire
Zentralbehörde für den gewerblichen Rechtsschutz;central industrial property office;son service central de la propriété industrielle
Übersetzung;a translation;une traduction
in der erteilten Fassung;the patent as granted;du brevet tel que délivré
geänderten Fassung;the patent as amended; du brevet tel que modifié
beschränkten Fassung;the patent as limited;du brevet tel que limité
nach seiner Wahl;at his option;à son choix
in einer seiner Amtssprachen;in one of its official languages;dans l'une de ses langues officielles
die Verwendung einer bestimmten Amtssprache vorgeschrieben hat;has prescribed the use of one specific official language;a imposé l'utilisation d'une langue officielle déterminée
in dieser Amtssprache einzureichen hat;supply in that language;doit fournir dans cette dernière langue
Einreichung der Übersetzung;supplying the translation; La traduction doit être produite
 Die Frist endet ;The period for  shall end ; La traduction doit être produite dans un délai de 
der Hinweis auf;the mention of; la mention 
Erteilung des europäischen Patents;the grant;la délivrance du brevet européen
seine Aufrechterhaltung in geänderter Fassung;maintenance in amended form;son maintien tel qu'il a été modifié
seine Beschränkung;limitation ; sa limitation
im Europäischen Patentblatt bekannt gemacht worden ist;is published in the European Patent Bulletin;compter de la date de publication au Bulletin européen des brevets
sofern nicht der betreffende Staat eine längere Frist vorschreibt;unless the State concerned prescribes a longer period;à moins que l'État considéré n'accorde un délai plus long
die Kosten für eine Veröffentlichung;costs of publication of;des frais de publication de 
ganz oder teilweise;all or part of the ;tout ou partie des frais
entrichten hat.;must pay ;acquitte
im Fall der Nichtbeachtung;in the event of failure to observe ;si les dispositions adoptées ne sont pas observées
die Wirkungen des europäischen Patents;the European patent ;le brevet européen est
als von Anfang an nicht eingetreten gelten.;shall be deemed to be void ab initio;est, dès l'origine, réputé sans effet
der ein Anmeldetag zuerkannt worden ist;which has been accorded a date of filing;à laquelle une date de dépôt a été accordée
hat die Wirkung einer vorschriftsmäßigen nationalen Anmeldung;shall be equivalent to a regular national filing;a la valeur d'un dépôt national régulier
in den benannten Vertragsstaaten;in the designated Contracting States;dans les États contractants désignés
gegebenenfalls;where appropriate;compte tenu, le cas échéant
mit der für die europäische Patentanmeldung in Anspruch genommenen Priorität. ;with the priority claimed for the European patent application. ;du droit de priorité invoqué à l'appui de la demande de brevet européen
 in Anspruch genommenen ;claimed;invoqué
Priorität;priority;du droit de priorité
kann vorschreiben;may prescribe;peut prescrire
Nichtbeachtung einer erlassenen Vorschrift;failure to observe the provisions adopted in accordance with;les dispositions adoptées en vertu des paragraphes 1 et 2 ne sont pas observées
 die Wirkungen des europäischen Patents in diesem Staat;the European patent … in that State.;le brevet européen est, dès l'origine, réputé sans effet dans cet État.
als von Anfang an nicht eingetreten gelten.;shall be deemed to be void ab initio in that State.;est, dès l'origine, réputé sans effet dans cet État.
 Das Gleiche gilt ; The same shall apply ; Il en est de même des effets
dessen Benennung;the designation of which;dont la désignation
zurückgenommen worden ist;is withdrawn;a été retirée
als zurückgenommen gilt;deemed to be withdrawn;est réputée retirée
Die in ... vorgesehenen Wirkungen;the effects specified in ;les effets prévus aux a
der europäischen Patentanmeldung und des darauf erteilten europäischen Patents ;The European patent application and the resulting European patent;La demande de brevet européen ainsi que le brevet européen auquel 
gelten in dem Umfang  als von Anfang an nicht eingetreten.;shall be deemed not to have had, from the outset;sont réputés n'avoir pas eu dès l'origine les effets prévus 
im Einspruchsverfahren;in opposition proceedings;une procédure d'opposition
Beschränkungsverfahren;limitation proceedings;une procédure de limitation
Nichtigkeitsverfahren;revocation proceedings;une procédure de nullité
widerrufen;revoked;a été révoqué
beschränkt worden ist;limited;a été limité
als von Anfang an nicht eingetreten.;shall be deemed not to have had, from the outset;sont réputés n'avoir pas eu dès l'origine
Der Schutzbereich [des europäischen Patents und der europäischen Patentanmeldung];The extent of the protection conferred by [a European patent or a European patent application];L'étendue de la protection conférée par [le brevet européen ou par la demande de brevet européen]
wird  bestimmt;shall be determined by;est déterminée par 
die Patentansprüche;the claims;les revendications
 Die Beschreibung;the description;la description
die Zeichnungen;the drawings;les dessins
zur Auslegung;to interpret ;à interpréter
heranzuziehen;shall be used;servent à interpréter
sind zur Auslegung heranzuziehen;shall be used to interpret;servent à interpréter
Für den Zeitraum bis;For the period up to;Pour la période allant jusqu'à
Erteilung des europäischen Patents;grant of the European patent;la délivrance du brevet européen
wird der Schutzbereich  bestimmt;the extent of the protection conferred by ... shall be determined by;l'étendue de la protection conférée par ... est déterminée par 
durch die in der veröffentlichten Anmeldung enthaltenen Patentansprüche;by the claims contained in the application as published;par les revendications contenues dans la demande telle que publiée
wird bestimmt;shall be determined by;est déterminée par
 Jedoch bestimmt das europäische Patent in seiner erteilten oder im Einspruchs-, Beschränkungs- oder Nichtigkeitsverfahren geänderten Fassung rückwirkend den Schutzbereich der Anmeldung, soweit deren Schutzbereich nicht erweitert wird; However, the European patent as granted or as amended in opposition, limitation or revocation proceedings shall determine retroactively the protection conferred by the application, in so far as such protection is not thereby extended; Toutefois, le brevet européen tel que délivré ou tel que modifié au cours de la procédure d'opposition, de limitation ou de nullité détermine rétroactivement la protection conférée par la demande, pour autant que cette protection ne soit pas étendue
das Patent in seiner erteilten Fassung;the patent as granted;le brevet tel que délivré
das Patent in seiner im Einspruchsverfahren geänderten Fassung;the patent as amended in opposition proceedings;le européen tel que modifié au cours de la procédure d'opposition
das Patent in seiner im Beschränkungsverfahren geänderten Fassung;the patent as amended in limitation proceedings;le européen tel que modifié au cours de la procédure de limitation
das Patent in seiner im Nichtigkeitsverfahren geänderten Fassung;the patent as amended in revocation proceedings;le européen tel que modifié au cours de la procédure de nullité
rückwirkend;retroactively;rétroactivement
den Schutzbereich der Anmeldung;the protection conferred by the application;la protection conférée par la demande
soweit deren Schutzbereich nicht erweitert wird;in so far as such protection is not thereby extended;pour autant que cette protection ne soit pas étendue
Der Wortlaut;The text ;Le texte
in der Verfahrenssprache;in the language of the proceedings;dans la langue de la procédure
stellt dar. ;shall be;est
die verbindliche Fassung;the authentic text;le texte qui fait foi
in Verfahren vor dem Europäischen Patentamt;in any proceedings before the European Patent Office;devant l'Office européen des brevets
in einer Sprache eingereicht worden;has been filed in a language which;a été déposée dans une langue qui
Amtssprache;an official language;une langue officielle
die nicht Amtssprache des Europäischen Patentamts ist;which is not an official language of the European Patent Office;qui n'est pas une langue officielle de l'Office européen des brevets
die ursprünglich eingereichte Fassung der Anmeldung;the application as filed;la demande telle qu'elle a été déposée
im Sinne dieses Übereinkommens. ;within the meaning of this Convention. ;au sens de la présente convention. 
kann vorsehen;may provide;peut prévoir
vorgeschriebene Übersetzung in einer seiner Amtssprachen;a translation into one of its official languages;une traduction dans une de ses langues officielles 
für den Fall maßgebend ist;shall be regarded as authentic;est considérée comme étant le texte qui fait foi
dass der Schutzbereich der europäischen Patentanmeldung oder des europäischen Patents in der Sprache der Übersetzung enger ist als der Schutzbereich in der Verfahrenssprache;in the event of the European patent application or European patent in the language of the translation conferring protection which is narrower than that conferred by it in the language of the proceedings. ;si la demande de brevet européen ou le brevet européen dans la langue de la traduction confère une protection moins étendue que celle conférée par ladite demande ou par ledit brevet dans la langue de la procédure. 
der eine Vorschrift nach Absatz 3 erlässt ;which adopts a provision under paragraph 3;qui arrête une disposition en application du paragraphe 3
muss gestatten;shall allow;doit permettre 
eine berichtigte Übersetzung;a corrected translation of ;de produire une traduction révisée de
Die berichtigte Übersetzung ;Such corrected translation;Cette traduction révisée 
hat erst dann rechtliche Wirkung, wenn;shall not have any legal effect until;n'a pas d'effet juridique aussi longtemps que
"die aufgestellten Voraussetzungen erfüllt sind;";any conditions have been complied with;les conditions n'ont pas été remplies
die von dem Vertragsstaat aufgestellten…;established by the Contracting State;fixées par l'État contractant
in entsprechender Anwendung der Artikel 65 Absatz 2 oder Artikel 67 Absatz 3;under Article 65, paragraph 2, or Article 67, paragraph 3;en application de l'article 65, paragraphe 2, ou de l'article 67, paragraphe 3
in gutem Glauben;in good faith;de bonne foi
eine Erfindung in Benutzung genommen;has used an invention;commencé à exploiter une invention
wirkliche und ernsthafte Veranstaltungen zur Benutzung einer Erfindung getroffen hat;has made effective and serious preparations for using an invention;a fait des préparatifs effectifs et sérieux à cette fin
deren Benutzung keine Verletzung darstellen würde;the use of which would not constitute infringement of;sans que cette exploitation constitue une contrefaçon de 
der Anmeldung oder des Patents in der Fassung der ursprünglichen Übersetzung ;the application or patent in the original translation;la demande ou du brevet dans le texte de la traduction initiale
nach Eintritt der rechtlichen Wirkung der berichtigten Übersetzung;after the corrected translation takes effect;après que la traduction révisée a pris effet
die Benutzung in seinem Betrieb oder für die Bedürfnisse seines Betriebs;may continue such use in the course of his business or for the needs thereof;peut poursuivre son exploitation dans son entreprise ou pour les besoins de celle-ci
unentgeltlich;without payment;à titre gratuit
kann übertragen werden;may be transferred;peut être transférée
einen oder mehrere der benannten Vertragsstaaten;one or more of the designated Contracting States;un ou plusieurs des États contractants désignés
Gegenstand von Rechten sein;give rise to rights for;donner lieu à la constitution de droits pour
Die rechtsgeschäftliche Übertragung;An assignment of ;La cession de 
muss schriftlich erfolgen ;shall be made in writing;doit être faite par écrit
bedarf;shall require;requiert
Unterschrift;the signature;la signature
der Vertragsparteien;the parties to the contract;des parties au contrat
ganz oder teilweise;in whole or in part;en sa totalité ou en partie
Gegenstand von Lizenzen;may be licensed;peut faire l'objet de licences
für alle oder einen Teil der Hoheitsgebiete der benannten Vertragsstaaten;for the whole or part of the territories of the designated Contracting States;pour tout ou partie des territoires des États contractants désignés
Soweit dieses Übereinkommen nichts anderes bestimmt;Unless this Convention provides otherwise;Sauf si la présente convention en dispose autrement
unterliegt ;shall be subject to;est soumise
als Gegenstand des Vermögens ;as an object of property;comme objet de propriété 
in jedem benannten Vertragsstaat und mit Wirkung für diesen Staat;in each designated Contracting State and with effect for such State;dans chaque État contractant désigné et avec effet dans cet État
unterliegt dem Recht, das in diesem Staat für nationale Patentanmeldungen gilt;shall be subject to the law applicable in that State to national patent applications;est soumise à la législation applicable dans ledit État aux demandes de brevet national
nationale Patentanmeldungen;national patent applications;aux demandes de brevet national
kann eingereicht werden;may be filed;peut être déposée
beim Europäischen Patentamt;with the European Patent Office ;soit auprès de l'Office européen des brevets
vorbehaltlich des Artikels 76 Absatz 1;and subject to Article 76, paragraph 1;sous réserve de l'article 76, paragraphe 1
bei der Zentralbehörde für den gewerblichen Rechtsschutz;with the central industrial property office;auprès du service central de la propriété industrielle
bei anderen zuständigen Behörden;other competent authority;des autres autorités compétentes
wenn das Recht dieses Staats es gestattet;if the law of a Contracting State so permits;si la législation d'un État contractant le permet
 Eine in dieser Weise eingereichte Anmeldung; Any application filed in this way; Toute demande ainsi déposée
hat dieselbe Wirkung, wie ;shall have the same effect as if;a les mêmes effets que si
an demselben Tag eingereicht worden wäre;it had been filed on the same date;que si elle avait été déposée à la même date
steht der Anwendung nicht entgegen;shall not preclude the application of;ne peut faire obstacle à l'application des
Rechts- und Verwaltungsvorschriften;legislative or regulatory provisions;des dispositions législatives ou réglementaires
für Erfindungen gelten;govern inventions which;régissent les inventions qui
wegen ihres Gegenstands;owing to the nature of their subject-matter;en raison de leur objet
nicht ohne vorherige Zustimmung;without the prior authorisation;sans autorisation préalable des
der zuständigen Behörden dieses Staats;the competent authorities of that State;des autorités compétentes de cet État
ins Ausland übermittelt werden dürfen;may not be communicated abroad;être communiquées à l'étranger
bestimmen;prescribe;prescrivent que
zuerst bei einer nationalen Behörde eingereicht werden müssen;any application is to be filed initially with a national authority;doit être initialement déposée auprès d'une autorité nationale
die unmittelbare Einreichung bei einer anderen Behörde;make direct filing with another authority;le dépôt direct auprès d'une autre autorité
von einer vorherigen Zustimmung abhängig machen;subject to prior authorisation;soumettent à une autorisation préalable
Eine europäische Teilanmeldung;A European divisional application;Toute demande divisionnaire de brevet européen
ist einzureichen;shall be filed;doit être déposée 
unmittelbar;directly;directement
nach Maßgabe der Ausführungsordnung;in accordance with the Implementing Regulations;auprès de l'Office européen des brevets conformément au règlement d'exécution
Gegenstand ;subject-matter;des éléments qui
er nicht über den Inhalt der früheren Anmeldung in der ursprünglich eingereichten Fassung hinausgeht;which does not extend beyond the content of the earlier application as filed;qui ne s'étendent pas au-delà du contenu de la demande antérieure telle qu'elle a été déposée
soweit diesem Erfordernis entsprochen wird;in so far as this requirement is complied with;dans la mesure où il est satisfait à cette exigence
 gilt als an dem Anmeldetag eingereicht;shall be deemed to have been filed on the date of filing of;est réputée déposée à la date de dépôt de
der früheren Anmeldung;the earlier application;la demande antérieure
genießt deren Prioritätsrecht;shall enjoy any right of priority;bénéficie du droit de priorité
Prioritätsrecht;right of priority;du droit de priorité
gelten als benannt;shall be deemed to be designated;sont réputés désignés
die bei Einreichung der Teilanmeldung;designated in the earlier application at the time of filing ;désignés dans la demande antérieure lors du dépôt d'une demande divisionnaire de brevet européen
leitet weiter;shall forward;transmet
bei ihr oder einer anderen zuständigen Behörde dieses Staats eingereichten europäischen Patentanmeldungen;filed with it or any other competent authority in that State;les demandes de brevet européen déposées auprès dudit service ou auprès de toute autre autorité compétente de cet État
an das Europäische Patentamt;to the European Patent Office;à l'Office européen des brevets
deren Gegenstand unter Geheimschutz gestellt worden ist;the subject of which has been made secret;dont l'objet a été mis au secret
die nicht rechtzeitig weitergeleitet wird;not forwarded in due time;qui n'est pas transmise dans les délais
gilt als zurückgenommen;shall be deemed to be withdrawn;est réputée retirée
Die europäische Patentanmeldung;A European patent application ;La demande de brevet européen
muss enthalten;shall contain;doit contenir
"einen Antrag auf Erteilung eines europäischen Patents; ";"a request for the grant of a European patent; ";"une requête en délivrance d'un brevet européen ; "
Antrag;a request for;une requête en
eine Beschreibung der Erfindung;a description of the invention;une description de l'invention
Beschreibung;a description;une description
einen oder mehrere Patentansprüche;one or more claims;une ou plusieurs revendications
die Zeichnungen, auf die sich die Beschreibung oder die Patentansprüche beziehen;any drawings referred to in the description or the claims;les dessins auxquels se réfèrent la description ou les revendications
Zeichnungen;drawings;les dessins
Zusammenfassung ;an abstract;un abrégé
Anmeldegebühr;filing fee;la taxe de dépôt
Recherchengebühr;the search fee;la taxe de recherche
sind zu entrichten;shall be subject to the payment of;donne lieu au paiement de
nicht rechtzeitig entrichtet;is not paid in due time;n'a pas été acquittée dans les délais
so gilt ... als zurückgenommen;… shall be deemed to be withdrawn;... est réputée retirée
 gelten alle Vertragsstaaten als benannt;shall be deemed to be designated;sont réputés désignés
Im Antrag auf;in the request for …;dans la requête en …
die diesem Übereinkommen bei Einreichung der europäischen Patentanmeldung angehören;All the Contracting States party to this Convention at the time of filing of;Tous les États contractants parties à la présente convention lors du dépôt de
Für die Benennung eines Vertragsstaats;The designation of a Contracting State;La désignation d'un État contractant
Benennungsgebühr;a designation fee;une taxe de désignation
erhoben werden;may be subject to the payment of;peut donner lieu au paiement d'une
kann zurückgenommen werden;may be withdrawn;peut être retirée à
jederzeit;at any time;à tout moment
bis zur Erteilung des europäischen Patents;up to the grant of the European patent;jusqu'à la délivrance du brevet européen
Der Anmeldetag;The date of filing of;la date de dépôt de
ist der Tag;shall be the date on which;est celle à laquelle il est
an dem die Erfordernisse erfüllt sind;the requirements are fulfilled;il est satisfait aux exigences prévues par
die in der Ausführungsordnung festgelegten Erfordernisse;the requirements laid down in the Implementing Regulations;prévues par le règlement d'exécution
ist der Erfinder zu nennen;shall designate the inventor;doit comprendre la désignation de l'inventeur
Anmelder;the applicant;le demandeur
nicht oder nicht allein der Erfinder;is not the inventor or is not the sole inventor;n'est pas l'inventeur ou l'unique inventeur
Erklärung;a statement;doit comporter une déclaration
wie der Anmelder das Recht auf das europäische Patent erlangt hat;indicating the origin of the right to the European patent;indiquant l'origine de l'acquisition du droit au brevet européen
darf enthalten;shall relate to;ne peut concerner que
eine einzige Erfindung;to one invention only;une seule invention
eine Gruppe von Erfindungen;a group of inventions;une pluralité d'inventions
die untereinander in der Weise verbunden sind;so linked as to;liées entre elles de telle sorte qu
sie eine einzige allgemeine erfinderische Idee verwirklichen;to form a single general inventive concept;elles ne forment qu'un seul concept inventif général
so deutlich;in a manner sufficiently clear;de façon suffisamment claire
vollständig;in a manner sufficiently complete for;de façon suffisamment complète pour qu'un homme du métier puisse l'exécuter. 
so deutlich und vollständig;in a manner sufficiently clear and complete for it;de façon suffisamment claire et complète
zu offenbaren;shall disclose;doit être exposée
Fachmann;a person skilled in the art;un homme du métier
sie ausführen kann;for it to be carried out by;puisse l'exécuter
müssen den Gegenstand angeben;shall define the matter for which;définissent l'objet de
für den Schutz begehrt wird ;for which protection is sought;l'objet de la protection demandée
Sie müssen deutlich und knapp gefasst sein;They shall be clear and concise;Elles doivent être claires et concises
von der Beschreibung gestützt werden;be supported by the description;se fonder sur la description
Die Zusammenfassung;The abstract;L'abrégé
dient;shall serve;sert
ausschließlich;the purpose of ... only;exclusivement
technischen Information;technical information;à des fins d'information technique
sie kann nicht für andere Zwecke, insbesondere nicht für die Bestimmung des Umfangs des begehrten Schutzes und für die Anwendung des Artikels 54 Absatz 3, herangezogen werden.;it may not be taken into account for any other purpose, in particular for interpreting the scope of the protection sought or applying Article 54, paragraph 3.;il ne peut être pris en considération pour aucune autre fin, notamment pour l'appréciation de l'étendue de la protection demandée et pour l'application de l'article 54, paragraphe 3.
sie kann nicht für andere Zwecke;it may not be taken into account for any other purpose;il ne peut être pris en considération pour aucune autre fin
Bestimmung des Umfangs des begehrten Schutzes;interpreting the scope of the protection sought;l'appréciation de l'étendue de la protection demandée
Anwendung des Artikels 54 Absatz 3;applying Article 54, paragraph 3;l'application de l'article 54, paragraphe 3
herangezogen werden;be taken into account for;être pris en considération pour
sind zu entrichten;shall be paid to ;être payées à
Jahresgebühren;Renewal fees;Des taxes annuelles
nach Maßgabe der Ausführungsordnung;in accordance with the Implementing Regulations;conformément au règlement d'exécution
das dritte und jedes weitere Jahr;the third year and each subsequent year;la troisième année et pour chacune des années suivantes
 Sie werden geschuldet;shall be due in respect of the;sont dues pour la 
gerechnet vom Anmeldetag an;calculated from the date of filing of the application;à compter de la date de dépôt de la demande
 Wird ... nicht rechtzeitig entrichtet; If a ... is not paid in due time; Si ... n'a pas été acquittée dans les délais
so gilt die Anmeldung als zurückgenommen;the application shall be deemed to be withdrawn;la demande est réputée retirée
Die Verpflichtung zur;The obligation to ;n'est exigible après 
Zahlung von Jahresgebühren;to pay renewal fees;le paiement de celle qui 
endet;shall terminate;n'est exigible après
die für das Jahr fällig ist;with the payment of the renewal fee due in respect of the year in which;qui doit être acquittée au titre de l'année au cours de laquelle la 
der Hinweis;the mention;la mention de
Europäischen Patentblatt;the European Patent Bulletin;au Bulletin européen des brevets
bekannt gemacht wird;is published in ;est publiée au
der Hinweis auf die Erteilung des europäischen Patents im Europäischen Patentblatt bekannt gemacht wird;the mention of the grant of the European patent is published in the European Patent Bulletin;la mention de la délivrance du brevet européen est publiée au Bulletin européen des brevets. 
der Hinweis auf die Erteilung des europäischen Patents im Europäischen Patentblatt bekannt gemacht wird;the mention of the grant of the European patent is published in the European Patent Bulletin;la mention de la délivrance du brevet européen est publiée au Bulletin européen des brevets. 
Jedermann;Any person who ;Celui qui a
