DE;EN;FR
können bewirkt werden;may be effected through;peuvent être faites par
soweit dies außergewöhnliche Umstände erfordern;where exceptional circumstances so require;lorsque des circonstances exceptionnelles l'exigent
durch Vermittlung der Zentralbehörden für den gewerblichen Rechtsschutz der Vertragsstaaten;the intermediary of the central industrial property offices of the Contracting States;par l'intermédiaire des services centraux de la propriété industrielle des États contractants
werden bestimmt;shall specify;détermine
einzuhalten;which are to be observed;qui doivent être observés
nicht bereits im Übereinkommen festgelegt sind;are not fixed by this Convention;qui ne sont pas fixés par la présente convention
die Art der Berechnung der Fristen;the manner of computation of time limits;le mode de calcul des délais
Voraussetzungen;conditions;les conditions
Voraussetzungen, unter denen Fristen verlängert werden können;conditions under which time limits may be extended ;les conditions dans lesquelles ils peuvent être prorogés
die Mindestdauer;the minima for time limits;la durée minimale
die Höchstdauer;the maxima for time limits;la durée maximale des délais
der zu bestimmenden Fristen ;to be determined by;des délais qui sont impartis par
Hat eine einzuhaltende Frist versäumt;fails to observe a time limit vis-à-vis the European Patent Office;n'a pas observé un délai à l'égard de l'Office européen des brevets
Weiterbehandlung der europäischen Patentanmeldung;further processing of the European patent application;la poursuite de la procédure relative à la demande de brevet européen
gibt dem Antrag statt;shall grant the request;fait droit à la requête s'il
wenn die Erfordernisse erfüllt sind;provided that the requirements are met;s'il est satisfait aux exigences prévues dans
Andernfalls weist es den Antrag zurück;Otherwise, it shall reject the request;Dans le cas contraire, il rejette la requête
Wird dem Antrag stattgegeben;If the request is granted;Lorsqu'il est fait droit à la requête
gelten als nicht eingetreten;shall be deemed not to have ensued;sont réputées ne pas s'être produites
die Rechtsfolgen der Fristversäumung;the legal consequences of the failure to observe the time limit;les conséquences juridiques de l'inobservation du délai
Von der Weiterbehandlung ausgeschlossen sind die Fristen des ;Further processing shall be ruled out in respect of the time limits in;Sont exclus de la poursuite de la procédure les délais prévus à l'article
Antrag auf Weiterbehandlung;requesting further processing;la requête en poursuite de la procédure
Antrag auf Wiedereinsetzung in den vorigen Stand;requesting re-establishment of rights;la requête en restitutio in integrum
kann ausnehmen;may rule out;peut exclure d
trotz Beachtung aller nach den gegebenen Umständen gebotenen Sorgfalt verhindert worden ist;in spite of all due care required by the circumstances having been taken;bien qu'ayant fait preuve de toute la vigilance nécessitée par les circonstances, n'a pas été en mesure d'observer un délai à l'égard de l'Office européen des brevets
gegenüber dem Europäischen Patentamt eine Frist einzuhalten;was unable to observe a time limit vis-à-vis the European Patent Office;n'a pas été en mesure d'observer un délai à l'égard de l'Office européen des brevets
wird wieder in den vorigen Stand eingesetzt;shall have his rights re-established;est rétabli dans ses droits si l'inobservation de ce délai a pour conséquence directe le rejet de la demande de brevet européen
Versäumung dieser Frist;the non-observance of this time limit;si l'inobservation de ce délai
unmittelbaren Folge;the direct consequence of;a pour conséquence directe
zurückgewiesen wird;causing the refusal of ;le rejet de la demande de brevet européen ou d'une requête
als zurückgenommen gilt;the deeming of the application to have been withdrawn;est réputée retirée
das europäische Patent widerrufen wird;the revocation of the European patent;la révocation du brevet européen
Verlust eines sonstigen Rechts oder eines Rechtsmittels eintritt;the loss of any other right or means of redress;la perte de tout autre droit ou d'un moyen de recours
Rechtsfolgen der Fristversäumung;the failure to observe the time limit;les conséquences juridiques de l'inobservation du délai
gelten als nicht eingetreten;shall be deemed not to have ensued;sont réputées ne pas s'être produites
in gutem Glauben;in good faith;de bonne foi
die Erfindung in Benutzung genommen hat;has used an invention;a commencé à exploiter l'invention
wirkliche und ernsthafte Veranstaltungen zur Benutzung getroffen hat;has made effective and serious preparations for using an invention;a fait des préparatifs effectifs et sérieux pour exploiter l'invention
Benutzung;such use;cette exploitation
in seinem Betrieb;in the course of his business;dans son entreprise
für die Bedürfnisse seines Betriebs;such use in the course of his business or for the needs thereof;pour les besoins de celle-ci
unentgeltlich;without payment;à titre gratuit
darf fortsetzen;may continue;peut poursuivre
lässt das Recht unberührt;Nothing shall limit the right of ;n'affecte pas le droit pour 
Wiedereinsetzung in Fristen zu gewähren;to grant re-establishment of rights in respect of time limits provided for;d'accorder la restitutio in integrum quant aux délais prévus
den Behörden dieses Staats gegenüber einzuhalten sind;to be observed vis-à-vis the authorities of such State;à observer à l'égard des autorités de cet État
kann geändert werden;may be amended;peut être modifié
In jedem Fall;In any event;En tout état de cause
ist Gelegenheit zu geben;shall be given ... opportunity;peut
zumindest einmal;at least one opportunity;au moins une fois
von sich aus;of his own volition;de sa propre initiative
dürfen nicht in der Weise geändert werden, dass;may not be amended in such a way that;ne peut être modifié de manière que
ihr Gegenstand;it contains subject-matter which;son objet
über den Inhalt der Anmeldung in der ursprünglich eingereichten Fassung hinausgeht;which extends beyond the content of the application as filed;s'étende au-delà du contenu de la demande telle qu'elle a été déposée
sein Schutzbereich erweitert wird ;as to extend the protection it confers;à étendre la protection qu'il confère
Auskünfte über den Stand der Technik zu erteilen;to provide information on;communiquer des informations sur
über den Stand der Technik;on prior art;sur l'état de la technique
der in nationalen oder regionalen Patentverfahren;in national or regional patent proceedings;dans des procédures de brevet nationales ou régionales 
in Betracht gezogen wurde;taken into consideration in;qui a été pris en considération dans
Unterlässt es der Anmelder;If the applicant fails to;Si le demandeur ne répond pas
Vorschriften nicht enthält;In the absence of procedural provisions;En l'absence d'une disposition de procédure
berücksichtigt;shall take into account;prend en considération
im Allgemeinen anerkannten Grundsätze des Verfahrensrechts;the principles of procedural law generally recognised;les principes généralement admis en la matière
führt;shall keep;tient
Europäisches Patentregister;a European Patent Register;un Registre européen des brevets
genannten Angaben;in which the particulars specified in ;toutes les indications mentionnées
eingetragen werden;shall be recorded;sont inscrites
Vor Veröffentlichung der europäischen Patentanmeldung;before the publication of the European patent application;avant que la demande de brevet européen ait été publiée
erfolgt keine Eintragung;No entry shall be made;Aucune inscription n'est portée au
kann Einsicht nehmen;open to inspection;est ouvert à l'inspection
Jedermann;open to public inspection;à l'inspection publique
Einsicht in die Akten europäischer Patentanmeldungen;Files relating to European patent applications shall not be made available for inspection;Les dossiers relatifs à des demandes de brevet européen
die noch nicht veröffentlicht worden sind;which have not yet been published;qui n'ont pas encore été publiées
wird nur mit Zustimmung des Anmelders gewährt;shall not be made available for inspection without the consent of the applicant;ne peuvent être ouverts à l'inspection publique qu'avec l'accord du demandeur
Wer nachweist, dass;Any person who can prove that;Quiconque prouve que
sich ihm gegenüber auf seine europäische Patentanmeldung berufen hat;has invoked the rights under the European patent application against him;s'est prévalu de sa demande de brevet européen à son encontre
kann  Akteneinsicht verlangen;may obtain inspection of the files;peut consulter le dossier dès avant
ohne Zustimmung des Anmelders;without the consent of the applicant;sans l'accord du demandeur
Nach Veröffentlichung einer europäischen Teilanmeldung;Where a European divisional application is published;Lorsqu'une demande divisionnaire est publiée
kann verlangen;may obtain;peut consulter
vorbehaltlich der in der Ausführungsordnung vorgeschriebenen Beschränkungen;subject to the restrictions laid down in the Implementing Regulations. ;sous réserve des restrictions prévues par le règlement d'exécution
die in der Ausführungsordnung genannten Angaben;the particulars specified in the Implementing Regulations;les indications mentionnées dans le règlement d'exécution
kann Dritten mitteilen oder veröffentlichen;may communicate to third parties or publish;peut communiquer à des tiers ou publier
gibt regelmäßig heraus;shall periodically publish;publie périodiquement
ein Europäisches Patentblatt;a European Patent Bulletin;un Bulletin européen des brevets
das die Angaben enthält;containing the particulars;contenant les indications
deren Veröffentlichung vorschreibt;the publication of which is prescribed by;dont la publication est prescrite par
ein Amtsblatt ;an Official Journal;un Journal officiel
allgemeine Bekanntmachungen;notices and information of a general character issued by the President of the European Patent Office;les communications
Mitteilungen des Präsidenten des Europäischen Patentamts;notices and information of a general character issued by the President of the European Patent Office;les informations d'ordre général émanant du Président de l'Office européen des brevets
sonstige dieses Übereinkommen und seine Anwendung betreffende Veröffentlichungen ;any other information relevant to this Convention or its implementation;toutes autres informations relatives à la présente convention et à son application
enthält;containing;contenant
übermitteln einander;communicate to each other;se communiquent
auf Ersuchen;on request;sur requête
sachdienliche Angaben;any useful information;toutes informations utiles 
soweit dieses Übereinkommen oder das nationale Recht nichts anderes vorsieht;Unless this Convention or national laws provide otherwise;Sauf si la présente convention ou la législation nationale en dispose autrement
Arbeitsabkommen;working agreements;en vertu d'accords de travail
Übermittlung von Angaben zwischen;the communication of information between;à l'échange d'informations entre
Absatz 1 gilt nach Maßgabe von Arbeitsabkommen auch für die Übermittlung von Angaben zwischen dem Europäischen Patentamt und;Paragraph 1 shall apply to the communication of information by virtue of working agreements between the European Patent Office and;Le paragraphe 1 s'applique à l'échange d'informations, en vertu d'accords de travail, entre l'Office européen des brevets, d'une part, et, d'autre part :
Absatz 1 gilt nach Maßgabe von Arbeitsabkommen auch für die Übermittlung von Angaben zwischen dem Europäischen Patentamt und;Paragraph 1 shall apply to the communication of information by virtue of working agreements between the European Patent Office and;Le paragraphe 1 s'applique à l'échange d'informations, en vertu d'accords de travail, entre l'Office européen des brevets, d'une part, et, d'autre part :
gilt auch für die Übermittlung von Angaben zwischen;shall apply to the communication of information by virtue of working agreements between;s'applique à l'échange d'informations, en vertu d'accords de travail, entre
Zentralbehörden für den gewerblichen Rechtsschutz anderer Staaten;the central industrial property offices of other States;les services centraux de la propriété industrielle d'autres États
den zwischenstaatlichen Organisationen, die mit der Erteilung von Patenten beauftragt sind;any intergovernmental organisation entrusted with the task of granting patents;toute organisation intergouvernementale chargée de la délivrance de brevets
zwischenstaatlichen Organisationen;any intergovernmental organisation;toute organisation intergouvernementale
mit der Erteilung von Patenten beauftragt sind;entrusted with the task of granting patents;chargée de la délivrance de brevets
;;
jeder anderen Organisation;any other organisation;toute autre organisation
Die Übermittlung von Angaben nach;Communications under;Les communications d'informations faites conformément au
unterliegt nicht den Beschränkungen des;shall not be subject to the restrictions laid down in;ne sont pas soumises aux restrictions prévues à
Der Verwaltungsrat;The Administrative Council;Le Conseil d'administration
kann beschließen;may decide;peut décider que
sofern;provided that;à condition que
bis zur Veröffentlichung der europäischen Patentanmeldung;until the European patent application has been published;jusqu'à la date de publication de la demande de brevet européen
vertraulich behandelt;treats the information communicated as confidential;traite les informations communiquées de manière confidentielle
Gerichte der Vertragsstaaten;courts of Contracting States;les juridictions des États contractants
Behörden der Vertragsstaaten;authorities of Contracting States;autres autorités compétentes des États contractants
unterstützen einander;shall give assistance to each other by;s'assistent mutuellement
durch die Erteilung von Auskünften;by communicating information;en se communiquant des informations
die Gewährung von Akteneinsicht;opening files for inspection;en se communiquant des dossiers
Staatsanwaltschaften;Public Prosecutors' Offices;des ministères publics
Gewährt Akteneinsicht;makes files available for inspection by;met des dossiers à la disposition des
so unterliegt diese nicht den Beschränkungen des;shall not be subject to the restrictions laid down in;n'est pas soumise aux restrictions prévues à
Beweisaufnahmen;any necessary enquiries;aux mesures d'instruction
nehmen Beweisaufnahmen vor;shall undertake any necessary enquiries;procèdent aux mesures d'instruction
andere gerichtliche Handlungen;other legal measures;autres actes juridictionnels
gerichtliche Handlungen innerhalb ihrer Zuständigkeit;within the limits of their jurisdiction, any necessary enquiries;dans les limites de leur compétence, aux mesures d'instruction
für das Europäische Patentamt auf dessen Ersuchen um Rechtshilfe;on behalf of the Office;procèdent pour l'Office
Rechtshilfe;?? on behalf of the Office and within the limits of their jurisdiction, any necessary enquiries or other legal measures. ;?? procèdent pour l'Office, dans les limites de leur compétence, aux mesures d'instruction ou autres actes juridictionnels. 
Ersuchen um;?? on behalf of the Office and within the limits of their jurisdiction, any necessary enquiries or other legal measures. ;?? procèdent pour l'Office, dans les limites de leur compétence, aux mesures d'instruction ou autres actes juridictionnels. 
übermitteln einander;shall despatch to each other;échangent
auf entsprechendes Ersuchen;on request;sur requête
kostenlos;free of charge;gratuitement
für ihre eigenen Zwecke;for their own use;pour leurs propres besoins
ein oder mehrere Exemplare ihrer Veröffentlichungen;one or more copies of their respective publications;un ou plusieurs exemplaires de leurs publications respectives
Vereinbarungen;agreements;des accords portan
über den Austausch von Veröffentlichungen;relating to the exchange of publications;sur l'échange de publications
die Übermittlung;supply of publications; l'envoi de publications
kann treffen ;may conclude;peut conclure
kann Vereinbarungen treffen;may conclude agreements;peut conclure des accords portant
ist niemand verpflichtet;no person shall be compelled to;nul n'est tenu de
zugelassenen Vertreter;a professional representative;un mandataire agréé
sich vertreten zu lassen;to be represented by;se faire représenter par
Natürliche Personen;Natural persons;Les personnes physiques
juristische Personen;legal persons;Les personnes morales
Wohnsitz;residence;leur domicile
Sitz;principal place of business;leur siège
müssen  vertreten sein;shall be represented by;doivent être représentées par
Handlungen vornehmen;act;agir par
mit Ausnahme der Einreichung einer europäischen Patentanmeldung;other than in filing a European patent application;sauf pour le dépôt d'une demande de brevet européen
können weitere Ausnahmen zugelassen werden;may permit other exceptions;d'autres exceptions peuvent être prévues par
können durch einen ihrer Angestellten handeln;may be represented by an employee;peuvent agir par l'entremise d'un employé
der kein zugelassener Vertreter zu sein braucht;who need not be a professional representative;cet employé n'est pas tenu d'être un mandataire agréé
Vollmacht;be authorised;un pouvoir
einer Vollmacht bedarf;who shall be authorised;qui doit disposer d'un pouvoir
kann vorgeschrieben werden;may provide;peut prévoir si
ob und unter welchen Voraussetzungen;whether and under what conditions;si et dans quelles conditions
Angestellte einer juristischen Person;an employee of a legal person;l'employé d'une personne morale
für andere juristische Personen mit Sitz in einem Vertragsstaat;other legal persons which have their principal place of business in a Contracting State;pour d'autres personnes morales qui ont leur siège dans un État contractant
die mit ihr wirtschaftlich verbunden sind;which have economic connections with the first legal person;ont des liens économiques avec elle
für ... handeln können;may also represent …;peut également agir pour
können Vorschriften vorgesehen werden;may lay down special provisions concerning;peuvent être prévues dans
gemeinsame Vertretung mehrerer Beteiligter;the common representation of parties;la représentation commune de parties
die gemeinsam handeln;acting in common;de parties agissant en commun
Die Vertretung;Representation;La représentation de
kann nur wahrgenommen werden;may only be undertaken by;ne peut être assurée que par
beim Europäischen Patentamt zu diesem Zweck geführten Liste;whose names appear on a list maintained for this purpose by the European Patent Office;inscrits sur une liste tenue à cet effet par l'Office européen des brevets
eingetragen sind;appear on;inscrits sur
die Staatsangehörigkeit eines Vertragsstaats besitzt;is a national of a Contracting State;possède la nationalité d'un État contractant
die Staatsangehörigkeit besitzt;is a national;possède la nationalité
Geschäftssitz;place of business;son domicile professionnel
Arbeitsplatz;place of employment;le lieu de son emploi
die europäische Eignungsprüfung;the European qualifying examination ;l'examen européen de qualification
die europäische Eignungsprüfung bestanden hat;has passed the European qualifying examination ;a satisfait aux épreuves de l'examen européen de qualification
Während eines Zeitraums von einem Jahr;During a period of one year from;Pendant une période d'un an à compter de
ab dem Zeitpunkt, zu dem der Beitritt eines Staats zu diesem Übereinkommen wirksam wird;the date on which the accession of a State to this Convention takes effect;la date à laquelle l'adhésion d'un État à la présente convention prend effet
wirksam wird;takes effect;prend effet
Beitritt eines Staats zu diesem Übereinkommen;accession of a State to this Convention;l'adhésion d'un État à la présente convention
Eintragung in diese Liste;entry on that list;à être inscrite sur la liste des mandataires agréés
befugt ist;is entitled;est habilitée à
auf dem Gebiet des Patentwesens;in patent matters;en matière de brevets d'invention
zu vertreten;to represent;à représenter
vor der Zentralbehörde für den gewerblichen Rechtsschutz dieses Staats;before the central industrial property office of that State;devant le service central de la propriété industrielle de cet État
Unterliegt;is not conditional upon;n'est pas subordonnée à
Befugnis;entitlement;cette habilitation
Erfordernis;requirement of;l'exigence d'une
besonderen beruflichen Befähigung;special professional qualifications;une qualification professionnelle spéciale
regelmäßig;regularly;à titre habituel
Vertretung ausgeübt haben;shall have so acted;doit avoir agi en tant que représentant
Bescheinigungen;certificates;d'attestations
beizufügen sind;accompanied by;accompagnée
aus denen sich ergibt;indicating;indiquant
genannten Voraussetzungen erfüllt sind;the conditions laid down in ... are fulfilled;que les conditions visées au ... sont remplies
sind berechtigt;shall be entitled;sont habilitées
aufzutreten;to act;à agir
zur Ausübung ihrer Tätigkeit;For the purpose of acting as;Aux fins d'agir en qualité de
unter Berücksichtigung;having regard to;compte tenu du
Zentralisierungsprotokolls;the Protocol on Centralisation;du protocole sur la centralisation
beigefügten;annexed;annexé
im Einzelfall;in individual cases;dans des cas particuliers
in Anwendung;in application of;en vertu de
zum Schutz der öffentlichen Sicherheit und Ordnung erlassenen Rechtsvorschriften;legal provisions adopted for the purpose of protecting public security and law and order;la législation nationale relative à l'ordre public et à la sécurité publique
entziehen;may remove;ne peuvent retirer
Vor einer solchen Maßnahme;Before such action is taken;avant qu'une telle mesure soit prise
ist zu hören;shall be consulted;doit être consulté
 Vor einer solchen Maßnahme ist der Präsident des Europäischen Patentamts zu hören; Before such action is taken, the President of the European Patent Office shall be consulted; Le Président de l'Office européen des brevets doit être consulté avant qu'une telle mesure soit prise
Rechtsanwalt;legal practitioner;avocat
der in einem Vertragsstaat zugelassen ist;qualified in a Contracting State;habilité à exercer dans l'un des États contractants
in dem Umfang wahrgenommen werden;to the extent that he is entitled in;dans la mesure où il peut agir dans
in dem er in diesem Staat die Vertretung auf dem Gebiet des Patentwesens ausüben kann;is entitled in that State to act as a professional representative in patent matters;dans la mesure où il peut agir dans cet État en qualité de mandataire en matière de brevets d'invention
... ist entsprechend anzuwenden;... shall apply mutatis mutandis; Les dispositions du ... sont applicables
Der Verwaltungsrat;The Administrative Council;Le Conseil d'administration
ist befugt;shall be competent to;a compétence pour
Vorschriften zu erlassen über;to adopt provisions governing;arrêter des dispositions relatives
Vorschriften und zu ändern über;to amend provisions governing;modifier des dispositions relatives
das Institut der beim Europäischen Patentamt zugelassenen Vertreter;the Institute of Professional Representatives before the European Patent Office;l'Institut des mandataires agréés près l'Office européen des brevets
im Folgenden  genannt;hereinafter referred to as the;ci-après dénommé 
die Vor- und Ausbildung;the qualifications and training;la qualification et à la formation exigées pour
die eine Person besitzen muss;required of a person for;exigées pour l'admission à
um zur europäischen Eignungsprüfung zugelassen zu werden;for admission to the European qualifying examination;l'admission à l'examen européen de qualification
Durchführung dieser Eignungsprüfung;the conduct of such examination;l'organisation des épreuves de cet examen
die Disziplinargewalt;the disciplinary power;au pouvoir disciplinaire
die... ausübt;exercised by;"au pouvoir disciplinaire de l'Institut ou de l'Office européen des brevets sur les mandataires agréés ; "
über die zugelassenen Vertreter ausübt;exercised in respect of professional representatives;sur les mandataires agréés
die Verschwiegenheitspflicht;the obligation of confidentiality;l'obligation de confidentialité
das Recht die Offenlegung von Mitteilungen zu verweigern;the privilege from disclosure;au droit du mandataire agréé de refuser de divulguer
ist Mitglied des Instituts;shall be a member of the Institute;est membre de l'Institut
leitet ein ;shall apply;engage
in den folgenden Fällen;in the following circumstances;dans les cas suivants
in den sonstigen vom nationalen Recht vorgesehenen Fällen;in such other cases as are provided for by the national law;dans les autres cas prévus par la législation nationale
Umwandlungsantrag;the request for conversion;la requête en transformation
ist zu stellen;shall be filed with;doit être présentée au
Im Fall des Absatzes 1;In the case referred to in paragraph 1;Dans le cas visé au paragraphe 1
vorbehaltlich der Vorschriften über die nationale Sicherheit;subject to the provisions governing national security;Sous réserve des dispositions relatives à la défense nationale
