DE;EN;FR
vorschriftsmäßig eingereicht hat;has duly filed;a régulièrement déposé
in einem oder mit Wirkung für ;in or for ;dans ou pour 
Vertragsstaat der Pariser Verbandsübereinkunft zum Schutz des gewerblichen Eigentums;any State party to the Paris Convention for the Protection of Industrial Property;un État partie à la Convention de Paris pour la protection de la propriété industrielle
Mitglied der Welthandelsorganisation ;any Member of the World Trade Organization;un membre de l'Organisation mondiale du commerce
eine Anmeldung für ein Patent;an application for a patent;une demande de brevet d'invention
ein Gebrauchsmuster;a utility model;une demande de modèle d'utilité
ein Gebrauchszertifikat;a utility certificate;certificat d'utilité
sein Rechtsnachfolger;his successor in title;son ayant cause
genießt;shall enjoy;jouit
die Anmeldung derselben Erfindung zum europäischen Patent;for the purpose of filing a European patent application in respect of the same invention;pour effectuer le dépôt d'une demande de brevet européen pour la même invention
während einer Frist von zwölf Monaten nach dem Anmeldetag der ersten Anmeldung;during a period of twelve months from the date of filing of the first application;pendant un délai de douze mois à compter de la date de dépôt de la première demande
Prioritätsrecht;a right of priority;un droit de priorité
wird anerkannt;shall be recognised as;Est reconnu comme
prioritätsbegründend;giving rise to a right of priority;donnant naissance au droit de priorité
nach dem nationalen Recht des Staats, in dem die Anmeldung eingereicht worden ist, die Bedeutung einer vorschriftsmäßigen nationalen Anmeldung zukommt;equivalent to a regular national filing under the national law of the State where it was made;ayant la valeur d'un dépôt national régulier en vertu de la législation nationale de l'État dans lequel il a été effectué
nach zwei- oder mehrseitigen Verträgen;under bilateral or multilateral agreements;d'accords bilatéraux ou multilatéraux
unter Einschluss dieses Übereinkommens;including this Convention;y compris la présente convention
vorschriftsmäßiger nationaler Anmeldung;A regular national filing;Par dépôt national régulier
ist zu verstehen;shall mean;on doit entendre
die zur Festlegung des Tags ausreicht;sufficient to establish the date on which the application was filed;suffit à établir la date à laquelle la demande a été déposée
wobei das spätere Schicksal der Anmeldung ohne Bedeutung ist;whatever the outcome of the application may be;quel que soit le sort ultérieur de cette demande
erste Anmeldung;first application;première demande
eine jüngere Anmeldung;a previous first application;une demande ultérieure
von deren Einreichung an die Prioritätsfrist läuft;for the purposes of determining priority;est le point de départ du délai de priorité
wird angesehen;shall be considered as;Est considérée
die denselben Gegenstand betrifft;in respect of the same subject-matter as;ayant le même objet qu
eine erste ältere in demselben oder für denselben Staat eingereichte Anmeldung;A subsequent application filed in or for the same State ;une première demande antérieure, déposée dans ou pour le même État
sofern;provided that;à la condition que
diese ältere Anmeldung;the previous application;cette demande antérieure
bis zur Einreichung der jüngeren Anmeldung;at the date of filing the subsequent application;à la date de dépôt de la demande ultérieure
zurückgenommen;has been withdrawn;ait été retirée
fallen gelassen;has been abandoned;ait été abandonnée
zurückgewiesen worden ist;has been refused;ait été refusée
und zwar bevor sie öffentlich ausgelegt worden ist;without being open to public inspection;sans avoir été soumise à l'inspection publique
ohne dass Rechte bestehen geblieben sind;without leaving any rights outstanding;sans laisser subsister de droits
ebenso wenig darf gewesen sein;and has not served as a;et qu'elle n'ait pas encore servi de
Grundlage für ; a basis for ;de base pour
die Inanspruchnahme des Prioritätsrechts;claiming a right of priority;la revendication du droit de priorité
kann nicht mehr dienen;may not serve as;ne peut plus servir de 
in diesem Fall;thereafter;alors
;;
erste Anmeldung;the first filing;le premier dépôt
eingereicht worden;has been made with;a été effectué auprès d
Pariser Verbandsübereinkunft zum Schutz des gewerblichen Eigentums;he Paris Convention for the Protection of Industrial Property;la Convention de Paris pour la protection de la propriété industrielle
Übereinkommen zur Errichtung der Welthandelsorganisation;the Agreement Establishing the World Trade Organization;l'Accord instituant l'Organisation mondiale du commerce
einer nicht ... unterliegenden Behörde für den gewerblichen Rechtsschutz;with an industrial property authority which is not subject to;d'un service de la propriété industrielle qui n'est pas lié par 
so sind die Absätze 1 bis 4 anzuwenden;paragraphs 1 to 4 shall apply if ;les paragraphes 1 à 4 s'appliquent si, suivant 
wenn ... anerkennt;if ... recognises that;ce service reconnaît qu
nach einer Bekanntmachung des Präsidenten des Europäischen Patentamts;according to a communication issued by the President of the European Patent Office;suivant une communication émanant du Président de l'Office européen des brevets
eine erste Anmeldung ein Prioritätsrecht begründet;a first filing made with the European Patent Office gives rise to a right of priority;un premier dépôt effectué auprès de l'Office européen des brevets donne naissance à un droit de priorité
unter Voraussetzungen und mit Wirkungen;under conditions and with effects equivalent;soumis à des conditions et ayant des effets équivalents
die denen der Pariser Verbandsübereinkunft vergleichbar sind;equivalent to those laid down in the Paris Convention;équivalents à ceux prévus par la Convention de Paris
die Priorität einer früheren Anmeldung in Anspruch nehmen will;desiring to take advantage of the priority of a previous application;veut se prévaloir de la priorité d'un dépôt antérieur
eine Prioritätserklärung;a declaration of priority;une déclaration de priorité
weitere erforderliche Unterlagen;any other document required;tout autre document exigé
einzureichen;shall file;est tenu de produire
mehrere Prioritäten;Multiple priorities;Des priorités multiples
können in Anspruch genommen werden;may be claimed;peuvent être revendiquées pour
selbst wenn sie aus verschiedenen Staaten stammen;notwithstanding the fact that they originated in different countries;même si elles proviennent d'États différents
 Für einen Patentanspruch;for any one claim;pour une même revendication
so beginnen Fristen;time limits shall run from;les délais qui ont
die vom Prioritätstag an laufen;which run from the date of priority;ont pour point de départ la date de priorité
vom frühesten Prioritätstag an zu laufen;shall run from the earliest date of priority;sont calculés à compter de la date de la priorité la plus ancienne
so umfasst das Prioritätsrecht nur die Merkmale der europäischen Patentanmeldung;the right of priority shall cover only those elements of the European patent application;le droit de priorité ne couvre que les éléments de la demande de brevet européen
die in der Anmeldung oder den Anmeldungen enthalten sind, deren Priorität in Anspruch genommen worden ist. ;which are included in the application or applications whose priority is claimed;qui sont contenus dans la demande ou dans les demandes dont la priorité est revendiquée. 
deren Priorität in Anspruch genommen worden ist;whose priority is claimed;dont la priorité est revendiquée
nicht in den in der früheren Anmeldung aufgestellten Patentansprüchen enthalten;do not appear among the claims formulated in the previous application;ne figurent pas parmi les revendications formulées dans la demande antérieure
Sind bestimmte Merkmale der Erfindung;If certain elements of the invention;Si certains éléments de l'invention
für die die Priorität in Anspruch genommen wird;for which priority is claimed;pour lesquels la priorité est revendiquée
so reicht es für die Gewährung der Priorität aus;priority may nonetheless be granted;pour que la priorité puisse être accordée
die Gesamtheit der Anmeldungsunterlagen;the documents of the previous application as a whole;que l'ensemble des pièces de la demande antérieure
diese Merkmale deutlich offenbart;specifically disclose such elements;révèle d'une façon précise lesdits éléments
hat die Wirkung;shall have the effect that;Par l'effet du 
für die Anwendung des Artikels 54 Absätze 2 und 3 ;for the purposes of Article 54, paragraphs 2;pour l'application de l'article 54, paragraphes 2
der Prioritätstag als Anmeldetag der europäischen Patentanmeldung gilt;the date of priority shall count as the date of filing of the European patent application;la date de priorité est considérée comme celle du dépôt de la demande de brevet européen
prüft;shall examine;examine
ob;whether;si
den Erfordernissen genügt;satisfies the requirements for;satisfait aux exigences pour
Zuerkennung eines Anmeldetags;the accordance of a date of filing;que lui soit accordée une date de dépôt
Kann ein Anmeldetag nicht zuerkannt werden;If a date of filing cannot be accorded;Si une date de dépôt ne peut être accordée 
nach der Prüfung nach Absatz 1;following the examination under paragraph 1;après l'examen effectué au titre du paragraphe 1
wird nicht als europäische Patentanmeldung behandelt;shall not be dealt with as a European patent application;n'est pas traitée en tant que demande de brevet européen
ob den Erfordernissen der Artikel 14, 78, 81 und gegebenenfalls des Artikels 88 Absatz 1 und des Artikels 133 Absatz 2 entsprochen worden ist;whether the requirements in Articles 14, Article 78 and Article 81, and, where applicable, Article 88, paragraph 1, and Article 133, paragraph 2 have been satisfied;s'il est satisfait aux exigences des articles 14, article 78, article 81 et, le cas échéant, de l'article 88, paragraphe 1, et de l'article 133, paragraphe 2
sowie den weiteren in der Ausführungsordnung festgelegten Erfordernissen;as well as any other requirement laid down in the Implementing Regulations;ainsi qu'à toute autre exigence prévue par le règlement d'exécution
Ist der europäischen Patentanmeldung ein Anmeldetag zuerkannt worden;If the European patent application has been accorded a date of filing;Si une date de dépôt a été accordée à la demande de brevet européen
so prüft das Europäische Patentamt;the European Patent Office shall examine;l'Office européen des brevets examine
Stellt fest; notes that there are ;constate l'existence
behebbare Mängel;deficiencies which may be corrected;d'irrégularités auxquelles il peut être remédié
bei der Prüfung nach Absatz 1 oder 3 ;in carrying out the examination under paragraphs 1 or 3;lors de l'examen effectué au titre des paragraphes 1 ou 3
so gibt es dem Anmelder Gelegenheit;it shall give the applicant an opportunity to;il donne au demandeur la possibilité de
diese Mängel zu beseitigen;to correct them;remédier à ces irrégularités
Wird ein Mangel nicht beseitigt;If any deficiency is not corrected;Lorsqu'il n'est pas remédié à
so wird die europäische Patentanmeldung zurückgewiesen;the European patent application shall be refused;la demande de brevet européen est rejetée
sofern dieses Übereinkommen keine andere Rechtsfolge vorsieht;unless a different legal consequence is provided for by this Convention;à moins que la présente convention ne prévoie une conséquence juridique différente
andere Rechtsfolge;different legal consequence;une conséquence juridique différente
 Betrifft;concerns;concerne
erlischt der Prioritätsanspruch für die Anmeldung;this right shall be lost for the application;elle entraîne la perte de ce droit pour la demande
Das Europäische Patentamt erstellt und veröffentlicht nach Maßgabe der Ausführungsordnung einen europäischen Recherchenbericht zu der europäischen Patentanmeldung auf der Grundlage der Patentansprüche unter angemessener Berücksichtigung der Beschreibung und der vorhandenen Zeichnungen. ;The European Patent Office shall, in accordance with the Implementing Regulations, draw up and publish a European search report in respect of the European patent application on the basis of the claims, with due regard to the description and any drawings. ;L'Office européen des brevets établit et publie, conformément au règlement d'exécution, un rapport de recherche européenne relatif à la demande de brevet européen sur la base des revendications, en tenant dûment compte de la description et des dessins existants. 
erstellt;draw up;établit
veröffentlicht;publish;publie
europäischen Recherchenbericht;a European search report;un rapport de recherche européenne
auf der Grundlage der Patentansprüche;in respect of the European patent application on the basis of the claims;sur la base des revendications
unter angemessener Berücksichtigung;with due regard to;en tenant dûment compte de
der vorhandenen Zeichnungen. ;any drawings;des dessins existants
so bald wie möglich ;as soon as possible ;dès que possible 
nach Ablauf von achtzehn Monaten;after the expiry of a period of eighteen months;après l'expiration d'un délai de dix-huit mois
nach dem Anmeldetag;from the date of filing;à compter de la date de dépôt
wenn eine Priorität in Anspruch genommen worden ist;if priority has been claimed;si une priorité a été revendiquée
nach dem Prioritätstag;from the date of priority;à compter de la date de priorité
vor Ablauf dieser Frist;before the expiry of that period;avant l'expiration de ce délai
auf Antrag des Anmelders;at the request of the applicant;sur requête du demandeur
gleichzeitig;at the same time as;à la même date que
mit der europäischen Patentschrift;the specification of the European patent;le fascicule du brevet européen
die Entscheidung über die Erteilung des Patents;the decision to grant the patent;la décision relative à la délivrance du brevet européen
vor Ablauf der in Absatz 1 a) genannten Frist wirksam wird;becomes effective before the expiry of the period referred to in paragraph 1(a);prend effet avant l'expiration du délai visé au paragraphe 1 a)
prüft auf Antrag;shall examine on request;Sur requête ... examine
die Erfindung, die sie zum Gegenstand hat;the invention to which it relates;l'invention qui en fait l'objet
den Erfordernissen dieses Übereinkommens genügen;meet the requirements of this Convention;satisfont aux exigences prévues par la présente convention
gilt erst als gestellt, wenn;shall not be deemed to be filed until;n'est réputée présentée qu'après 
die Prüfungsgebühr entrichtet worden ist;until the examination fee has been paid;qu'après le paiement de la taxe d'examen
Prüfungsantrag;request for examination;la requête en examen
Wird nicht rechtzeitig gestellt;If ... has been made in due time;n'est pas présentée dans les délais
gilt die Anmeldung als zurückgenommen;the application shall be deemed to be withdrawn;la demande est réputée retirée
Ergibt die Prüfung;If the examination reveals that ;S'il résulte de l'examen que 
so fordert die Prüfungsabteilung den Anmelder so oft wie erforderlich auf;the Examining Division shall invite the applicant, as often as necessary;la division d'examen invite le demandeur, aussi souvent qu'il est nécessaire
eine Stellungnahme einzureichen;to file his observations;à présenter ses observations
vorbehaltlich des Artikels 123 Absatz 1, die Anmeldung zu ändern. ;subject to Article 123, paragraph 1, to amend the application.;sous réserve de l'article 123, paragraphe 1, à modifier la demande.
Unterlässt es der Anmelder;If the applicant fails to reply;Si le demandeur ne répond pas
auf eine Mitteilung der Prüfungsabteilung rechtzeitig zu antworten;fails to reply in due time to any communication from the Examining Division;ne répond pas dans les délais à une notification de la division d'examen
so gilt die Anmeldung als zurückgenommen. ;the application shall be deemed to be withdrawn. ;la demande est réputée retirée
Ist die Prüfungsabteilung der Auffassung;If the Examining Division is of the opinion that;Si la division d'examen estime que
die europäische Patentanmeldung und die Erfindung, die sie zum Gegenstand hat, den Erfordernissen dieses Übereinkommens genügen;that the European patent application and the invention to which it relates meet the requirements of this Convention;que la demande de brevet européen et l'invention qui en fait l'objet satisfont aux exigences prévues par la présente convention
so beschließt sie die Erteilung des europäischen Patents;it shall decide to grant a European patent;elle décide de délivrer le brevet européen
sofern die in der Ausführungsordnung genannten Voraussetzungen erfüllt sind;provided that the conditions laid down in the Implementing Regulations are fulfilled;pour autant que les conditions prévues par le règlement d'exécution soient remplies
so weist sie die Anmeldung zurück;it shall refuse the application;elle rejette la demande
sofern dieses Übereinkommen keine andere Rechtsfolge vorsieht;unless this Convention provides for a different legal consequence;à moins que la présente convention ne prévoie une conséquence juridique différente
Die Entscheidung über die Erteilung des europäischen Patents wird an dem Tag wirksam;The decision to grant a European patent shall take effect on the date on which;La décision relative à la délivrance du brevet européen prend effet à la date à laquelle
der Hinweis auf die Erteilung im Europäischen Patentblatt bekannt gemacht wird; the mention of the grant is published in the European Patent Bulletin. ;la mention de la délivrance est publiée au Bulletin européen des brevets
veröffentlicht;shall publish;publie
Innerhalb von neun Monaten nach;Within nine months of ;Dans un délai de neuf mois à compter de
jedermann;any person;toute personne
kann Einspruch einlegen;may give notice to the European Patent Office of opposition;peut faire opposition
gegen dieses Patent ;to that patent;à ce brevet
beim Europäischen Patentamt;give notice to the European Patent Office of;auprès de l'Office européen des brevets
 Der Einspruch gilt erst als eingelegt, wenn; Notice of opposition shall not be deemed to have been filed; L'opposition n'est réputée formée qu
die Einspruchsgebühr entrichtet worden ist;until the opposition fee has been paid;qu'après le paiement de la taxe d'opposition
Einspruchsgebühr;the opposition fee;le paiement de la taxe d'opposition
erfasst;shall apply to;affecte
für alle Vertragsstaaten, in denen es Wirkung hat;in all the Contracting States in which that patent has effect;dans tous les États contractants dans lesquels il produit ses effets
Einspruchsverfahren;the opposition proceedings;la procédure d'opposition
sind beteiligt;shall be parties to the opposition proceeding;sont parties
Patentinhaber;the proprietor of the patent;le titulaire du brevet
die Einsprechenden;Opponents;Les opposants
Weist nach;provides evidence that;apporte la preuve que
aufgrund einer rechtskräftigen Entscheidung;following a final decision;en vertu d'une décision passée en force de chose jugée
anstelle des bisherigen Patentinhabers ;instead of the previous proprietor;au lieu et place du titulaire précédent
in das Patentregister dieses Staats;in the patent register of such State;est inscrite au registre des brevets
eingetragen ist;has been entered ;est inscrite
so tritt er an die Stelle des bisherigen Patentinhabers;replace the previous proprietor in respect of such State;elle est substituée à ce dernier pour ledit État
gelten nicht als gemeinsame Inhaber;shall not be regarded as joint proprietors;ne sont pas considérés comme copropriétaires
dass beide dies verlangen;unless both so request;à moins qu'ils ne demandent tous deux à l'être
 Abweichend von Artikel 118 ; Notwithstanding Article 118; Nonobstant l'article 118
derjenige, der sein Recht geltend macht;the person making the request;la personne qui fait ainsi valoir ses droits
kann darauf gestützt werden;may be filed on the grounds that;ne peut être fondée que sur les motifs suivants
der Gegenstand des europäischen Patents;the subject-matter of the European patent;l'objet du brevet européen
nach den Artikeln 52 bis Artikel 57 nicht patentierbar ist;is not patentable under Articles Article 52 to Article 57;n'est pas brevetable en vertu des articles 52 à article 57
patentierbar;patentable;brevetable
die Erfindung nicht so deutlich und vollständig offenbart;does not disclose the invention in a manner sufficiently clear and complete for it;n'expose pas l'invention de façon suffisamment claire et complète
dass ein Fachmann sie ausführen kann;to be carried out by a person skilled in the art;pour qu'un homme du métier puisse l'exécuter
über den Inhalt hinausgeht;extends beyond;s'étend au-delà du contenu de
Anmeldung in der ursprünglich eingereichten Fassung;the content of the application as filed;du contenu de la demande telle qu'elle a été déposée
wenn das Patent auf einer Teilanmeldung beruht;if the patent was granted on a divisional application;si le brevet a été délivré sur la base d'une demande divisionnaire
wenn das Patent auf einer nach Artikel 61 eingereichten neuen Anmeldung beruht;if the patent was granted on a new application filed under Article 61;si le brevet a été délivré sur la base d'une nouvelle demande déposée en vertu de l'article 61
über den Inhalt der früheren Anmeldung in der ursprünglich eingereichten Fassung hinausgeht;extends beyond the content of the earlier application as filed;s'étend au-delà du contenu de la demande antérieure telle qu'elle a été déposée
Ist der Einspruch zulässig;If the opposition is admissible;Si l'opposition est recevable
so prüft die Einspruchsabteilung;the Opposition Division shall examine;la division d'opposition examine
Einspruchsabteilung;the Opposition Division;la division d'opposition
Einspruchsgrund;one ground for opposition;un motif d'opposition
der Aufrechterhaltung des europäischen Patents entgegensteht;prejudices the maintenance of the European patent;s'oppose au maintien du brevet européen
nach Artikel 100;under Article 100;visé à l'article 100
 Bei dieser Prüfung;During this examination; Au cours de cet examen
fordert so oft wie erforderlich auf;shall invite;invite
eine Stellungnahme einzureichen;to file observations on;à présenter leurs observations sur
die Beteiligten;the parties;les parties
so oft wie erforderlich;as often as necessary;aussi souvent qu'il est nécessaire
zu ihren Bescheiden;on communications issued by itself;sur les notifications qu'elle leur a adressées
zu den Schriftsätzen anderer Beteiligter;on communications from another party;sur les communications qui émanent d'autres parties
dass wenigstens ein Einspruchsgrund der Aufrechterhaltung des europäischen Patents entgegensteht;at least one ground for opposition prejudices the maintenance of the European patent;au moins un motif d'opposition s'oppose au maintien du brevet européen
so widerruft sie das Patent;it shall revoke the patent;elle révoque le brevet
 Andernfalls; Otherwise; Dans le cas contraire
weist zurück;it shall reject;elle rejette
unter Berücksichtigung der vom Patentinhaber im Einspruchsverfahren vorgenommenen Änderungen;taking into consideration the amendments made by the proprietor of the European patent during the opposition proceedings;compte tenu des modifications apportées par le titulaire du brevet européen au cours de la procédure d'opposition
Änderungen;the amendments;des modifications
im Einspruchsverfahren;during the opposition proceedings;au cours de la procédure d'opposition
den Erfordernissen dieses Übereinkommens genügen;meet the requirements of this Convention;satisfont aux exigences de la présente convention
so beschließt sie die Aufrechterhaltung des Patents in geänderter Fassung;it shall decide to maintain the patent as amended;elle décide de maintenir le brevet tel qu'il a été modifié
sofern die in der Ausführungsordnung genannten Voraussetzungen erfüllt sind;provided that the conditions laid down in the Implementing Regulations are fulfilled;pour autant que les conditions prévues par le règlement d'exécution soient remplies
so widerruft sie das Patent;it shall revoke the patent;elle révoque le brevet
in geänderter Fassung aufrechterhalten worden;is maintained as amended;a été maintenu tel qu'il a été modifié
eine neue europäische Patentschrift;a new specification of the European patent;un nouveau fascicule du brevet européen
Im Einspruchsverfahren jeder Beteiligte;Each party to the opposition proceedings;Chacune des parties à la procédure d'opposition
trägt die ihm erwachsenen Kosten selbst;shall bear the costs it has incurred;supporte les frais qu'elle a exposés
wenn dies der Billigkeit entspricht;for reasons of equity;dans la mesure où l'équité l'exige
eine andere Verteilung der Kosten;a different apportionment of costs;une répartition différente des frais
anordnet;orders;n'arrête
Das Verfahren zur Kostenfestsetzung;The procedure for fixing costs;la procédure de fixation des frais
regelt;shall be laid down in;détermine
regelt die Ausführungsordnung;shall be laid down in the Implementing Regulations;détermine la procédure de fixation des frais
